<?xml version="1.0" encoding="UTF-8"?>
<xs:schema xmlns:xs="http://www.w3.org/2001/XMLSchema" 
		   targetNamespace="http://www.example.org/spring-context-configuration" 
		   xmlns:tns="http://www.example.org/spring-context-configuration" 
		   elementFormDefault="qualified">
	<xs:element name="packages">
		<xs:annotation>
			<xs:documentation>Root Element</xs:documentation>
		</xs:annotation>
		<xs:complexType>
			<xs:sequence>
				<xs:element name="package" minOccurs="1" maxOccurs="unbounded">
					<xs:complexType>
						<xs:sequence>
							<xs:element name="description" type="xs:string" minOccurs="0" maxOccurs="1"/>
							<xs:element name="files" maxOccurs="1">
								<xs:complexType mixed="true">
									<xs:choice>
										<xs:element name="list" minOccurs="0" maxOccurs="1">
											<xs:complexType>
												<xs:sequence>
													<xs:element name="file" minOccurs="0" maxOccurs="unbounded"/>
												</xs:sequence>
											</xs:complexType>
										</xs:element>
									</xs:choice>
								</xs:complexType>
							</xs:element>
						</xs:sequence>
						<xs:attribute name="name" type="xs:string"/>
					</xs:complexType>
				</xs:element>
			</xs:sequence>
		</xs:complexType>
	</xs:element>
</xs:schema>